{
  "schema_version": 1,
  "library_track_observation_id": "77777777-7777-4777-8777-777777777777",
  "subject_id": "11111111-1111-4111-8111-111111111111",
  "track_ref_id": "22222222-2222-4222-8222-222222222222",
  "track_ref_revision": 1,
  "observed_at": "2026-08-25T04:37:31Z",
  "source_kind": "provider_library_snapshot",
  "source_batch_ref": "66666666-6666-4666-8666-666666666666",
  "source_record_digest": "aaaaaaaaaaaaaaaaaaaaaaaaaaaaaaaaaaaaaaaaaaaaaaaaaaaaaaaaaaaaaaaa",
  "aggregate_state": {
    "play_count": 12,
    "last_played_at": "2026-08-24T04:00:00Z",
    "loved": true
  },
  "library_state": {
    "date_added": "2026-01-10T09:00:00Z",
    "subscription_catalog_item": true
  },
  "provenance": {
    "source_kind": "import",
    "captured_at": "2026-08-25T04:37:31Z",
    "import_batch_id": "66666666-6666-4666-8666-666666666666"
  }
}
